{
  "$schema": "http://json-schema.org/draft-07/schema#",
  "$id": "https://inkclone/profiles/schema/profile.schema.json",
  "title": "InkClone Handwriting Profile",
  "description": "Formal schema for an InkClone handwriting profile. Describes a complete set of extracted glyphs, style metrics, and quality metadata for a single writing sample.",
  "type": "object",
  "required": [
    "profile_id",
    "created_at",
    "source_method",
    "character_coverage",
    "per_character",
    "style_metrics",
    "missing_characters",
    "weak_characters",
    "usable"
  ],
  "additionalProperties": false,
  "properties": {
    "profile_id": {
      "type": "string",
      "description": "Unique identifier for the profile. Must be a valid directory name.",
      "pattern": "^[a-zA-Z0-9_-]+$",
      "minLength": 1
    },
    "created_at": {
      "type": "string",
      "description": "ISO 8601 timestamp when the profile was created or last migrated.",
      "format": "date-time",
      "examples": ["2026-04-16T10:00:00Z", "2026-04-16T10:00:00.123456"]
    },
    "source_method": {
      "type": "string",
      "description": "How glyphs were extracted: template=from printed template, freeform=from free handwriting, hybrid=mix of both.",
      "enum": ["template", "freeform", "hybrid"]
    },
    "source_images": {
      "type": "array",
      "description": "Relative paths to the source images used for glyph extraction.",
      "items": {
        "type": "string"
      },
      "default": []
    },
    "character_coverage": {
      "type": "object",
      "description": "Coverage statistics for each Unicode category.",
      "required": [
        "lowercase_pct",
        "uppercase_pct",
        "digits_pct",
        "punctuation_pct",
        "total_characters",
        "total_variants"
      ],
      "additionalProperties": false,
      "properties": {
        "lowercase_pct": {
          "type": "number",
          "description": "Percentage of lowercase letters (a-z) covered. 100 = all 26.",
          "minimum": 0,
          "maximum": 100
        },
        "uppercase_pct": {
          "type": "number",
          "description": "Percentage of uppercase letters (A-Z) covered. 100 = all 26.",
          "minimum": 0,
          "maximum": 100
        },
        "digits_pct": {
          "type": "number",
          "description": "Percentage of digits (0-9) covered. 100 = all 10.",
          "minimum": 0,
          "maximum": 100
        },
        "punctuation_pct": {
          "type": "number",
          "description": "Percentage of standard punctuation covered (.,!?'-:;()). 100 = all 10.",
          "minimum": 0,
          "maximum": 100
        },
        "total_characters": {
          "type": "integer",
          "description": "Total number of distinct characters with at least one glyph variant.",
          "minimum": 0
        },
        "total_variants": {
          "type": "integer",
          "description": "Total number of glyph images across all characters.",
          "minimum": 0
        }
      }
    },
    "per_character": {
      "type": "object",
      "description": "Per-character glyph data. Keys are single characters or special names.",
      "additionalProperties": {
        "$ref": "#/definitions/character_entry"
      }
    },
    "style_metrics": {
      "type": "object",
      "description": "Aggregate style metrics measured from all glyphs.",
      "required": [
        "avg_glyph_width",
        "median_x_height",
        "baseline_offset",
        "slant_estimate_degrees",
        "avg_stroke_width",
        "ink_density"
      ],
      "additionalProperties": false,
      "properties": {
        "avg_glyph_width": {
          "type": "number",
          "description": "Mean glyph width in pixels (at 128px canonical height).",
          "minimum": 0
        },
        "median_x_height": {
          "type": "number",
          "description": "Median height of lowercase x-height glyphs in pixels.",
          "minimum": 0
        },
        "baseline_offset": {
          "type": "number",
          "description": "Mean vertical offset from baseline to ink bottom, in pixels. Positive = below.",
          "minimum": -200,
          "maximum": 200
        },
        "slant_estimate_degrees": {
          "type": "number",
          "description": "Estimated slant angle in degrees. Positive = right-leaning.",
          "minimum": -45,
          "maximum": 45
        },
        "avg_stroke_width": {
          "type": "number",
          "description": "Average stroke width in pixels at canonical glyph height.",
          "minimum": 0
        },
        "ink_density": {
          "type": "number",
          "description": "Mean ratio of ink (non-transparent) pixels to total bounding-box area across all glyphs. Range 0-1.",
          "minimum": 0,
          "maximum": 1
        }
      }
    },
    "missing_characters": {
      "type": "array",
      "description": "Characters with no glyph variants in this profile.",
      "items": {
        "type": "string",
        "minLength": 1,
        "maxLength": 1
      },
      "uniqueItems": true
    },
    "weak_characters": {
      "type": "array",
      "description": "Characters present but with confidence < 0.5 (noisy or unreliable glyphs).",
      "items": {
        "type": "string",
        "minLength": 1,
        "maxLength": 1
      },
      "uniqueItems": true
    },
    "usable": {
      "type": "boolean",
      "description": "Whether the profile meets minimum quality for rendering. True if total_characters >= 26 (full lowercase coverage)."
    }
  },
  "definitions": {
    "character_entry": {
      "type": "object",
      "description": "Glyph data for a single character.",
      "required": [
        "variants",
        "avg_width",
        "avg_height",
        "confidence",
        "extraction_method"
      ],
      "additionalProperties": false,
      "properties": {
        "variants": {
          "type": "array",
          "description": "Relative paths to glyph PNG files for this character, ordered by variant index.",
          "items": {
            "type": "string"
          },
          "minItems": 1
        },
        "avg_width": {
          "type": "number",
          "description": "Mean width in pixels across all variant images.",
          "minimum": 0
        },
        "avg_height": {
          "type": "number",
          "description": "Mean height in pixels across all variant images.",
          "minimum": 0
        },
        "confidence": {
          "type": "number",
          "description": "Estimated quality of the glyph extraction, 0-1. Values below 0.5 indicate noisy or unreliable glyphs.",
          "minimum": 0,
          "maximum": 1
        },
        "extraction_method": {
          "type": "string",
          "description": "How this glyph was obtained.",
          "enum": ["template_cell", "connected_component", "fallback"]
        }
      }
    }
  }
}
