{
  "profile_id": "freeform_vishnu",
  "created_at": "2026-04-16T15:03:08Z",
  "source_method": "freeform",
  "source_images": [],
  "character_coverage": {
    "lowercase_pct": 100.0,
    "uppercase_pct": 100.0,
    "digits_pct": 100.0,
    "punctuation_pct": 80.0,
    "total_characters": 75,
    "total_variants": 172
  },
  "per_character": {
    "!": {
      "variants": [
        "glyphs/exclaim_0.png"
      ],
      "avg_width": 20.0,
      "avg_height": 128.0,
      "confidence": 0.9,
      "extraction_method": "connected_component"
    },
    "\"": {
      "variants": [
        "glyphs/quote_0.png"
      ],
      "avg_width": 128.0,
      "avg_height": 128.0,
      "confidence": 0.9,
      "extraction_method": "connected_component"
    },
    "#": {
      "variants": [
        "glyphs/hash_0.png"
      ],
      "avg_width": 61.0,
      "avg_height": 128.0,
      "confidence": 0.778,
      "extraction_method": "connected_component"
    },
    "&": {
      "variants": [
        "glyphs/ampersand_0.png"
      ],
      "avg_width": 68.0,
      "avg_height": 128.0,
      "confidence": 0.735,
      "extraction_method": "connected_component"
    },
    "'": {
      "variants": [
        "glyphs/apostrophe_0.png"
      ],
      "avg_width": 71.0,
      "avg_height": 128.0,
      "confidence": 0.9,
      "extraction_method": "connected_component"
    },
    ",": {
      "variants": [
        "glyphs/comma_0.png"
      ],
      "avg_width": 72.0,
      "avg_height": 128.0,
      "confidence": 0.9,
      "extraction_method": "connected_component"
    },
    "-": {
      "variants": [
        "glyphs/hyphen_0.png"
      ],
      "avg_width": 728.0,
      "avg_height": 128.0,
      "confidence": 0.9,
      "extraction_method": "connected_component"
    },
    ".": {
      "variants": [
        "glyphs/period_0.png"
      ],
      "avg_width": 128.0,
      "avg_height": 128.0,
      "confidence": 0.9,
      "extraction_method": "connected_component"
    },
    "/": {
      "variants": [
        "glyphs/slash_0.png"
      ],
      "avg_width": 45.0,
      "avg_height": 128.0,
      "confidence": 0.701,
      "extraction_method": "connected_component"
    },
    "0": {
      "variants": [
        "glyphs/digit_0_0.png"
      ],
      "avg_width": 159.0,
      "avg_height": 128.0,
      "confidence": 0.9,
      "extraction_method": "connected_component"
    },
    "1": {
      "variants": [
        "glyphs/digit_1_0.png"
      ],
      "avg_width": 274.0,
      "avg_height": 128.0,
      "confidence": 0.664,
      "extraction_method": "connected_component"
    },
    "2": {
      "variants": [
        "glyphs/digit_2_0.png"
      ],
      "avg_width": 332.0,
      "avg_height": 128.0,
      "confidence": 0.713,
      "extraction_method": "connected_component"
    },
    "3": {
      "variants": [
        "glyphs/digit_3_0.png"
      ],
      "avg_width": 362.0,
      "avg_height": 128.0,
      "confidence": 0.72,
      "extraction_method": "connected_component"
    },
    "4": {
      "variants": [
        "glyphs/digit_4_0.png"
      ],
      "avg_width": 51.0,
      "avg_height": 128.0,
      "confidence": 0.912,
      "extraction_method": "connected_component"
    },
    "5": {
      "variants": [
        "glyphs/digit_5_fallback.png"
      ],
      "avg_width": 80.0,
      "avg_height": 128.0,
      "confidence": 0.7,
      "extraction_method": "fallback"
    },
    "6": {
      "variants": [
        "glyphs/digit_6_fallback.png"
      ],
      "avg_width": 82.0,
      "avg_height": 128.0,
      "confidence": 0.7,
      "extraction_method": "fallback"
    },
    "7": {
      "variants": [
        "glyphs/digit_7_0.png"
      ],
      "avg_width": 133.0,
      "avg_height": 128.0,
      "confidence": 0.9,
      "extraction_method": "connected_component"
    },
    "8": {
      "variants": [
        "glyphs/digit_8_fallback.png"
      ],
      "avg_width": 78.0,
      "avg_height": 128.0,
      "confidence": 0.7,
      "extraction_method": "fallback"
    },
    "9": {
      "variants": [
        "glyphs/digit_9_0.png"
      ],
      "avg_width": 256.0,
      "avg_height": 128.0,
      "confidence": 0.9,
      "extraction_method": "connected_component"
    },
    ":": {
      "variants": [
        "glyphs/colon_0.png"
      ],
      "avg_width": 41.0,
      "avg_height": 128.0,
      "confidence": 0.921,
      "extraction_method": "connected_component"
    },
    ";": {
      "variants": [
        "glyphs/semicolon_0.png"
      ],
      "avg_width": 30.0,
      "avg_height": 128.0,
      "confidence": 0.87,
      "extraction_method": "connected_component"
    },
    "?": {
      "variants": [
        "glyphs/question_0.png"
      ],
      "avg_width": 74.0,
      "avg_height": 128.0,
      "confidence": 0.734,
      "extraction_method": "connected_component"
    },
    "@": {
      "variants": [
        "glyphs/at_0.png"
      ],
      "avg_width": 125.0,
      "avg_height": 128.0,
      "confidence": 0.75,
      "extraction_method": "connected_component"
    },
    "A": {
      "variants": [
        "glyphs/upper_A_fallback.png"
      ],
      "avg_width": 382.0,
      "avg_height": 128.0,
      "confidence": 0.7,
      "extraction_method": "fallback"
    },
    "B": {
      "variants": [
        "glyphs/upper_B_fallback.png"
      ],
      "avg_width": 44.0,
      "avg_height": 128.0,
      "confidence": 0.7,
      "extraction_method": "fallback"
    },
    "C": {
      "variants": [
        "glyphs/upper_C_fallback.png"
      ],
      "avg_width": 67.0,
      "avg_height": 128.0,
      "confidence": 0.7,
      "extraction_method": "fallback"
    },
    "D": {
      "variants": [
        "glyphs/upper_D_fallback.png"
      ],
      "avg_width": 91.0,
      "avg_height": 128.0,
      "confidence": 0.7,
      "extraction_method": "fallback"
    },
    "E": {
      "variants": [
        "glyphs/upper_E_fallback.png"
      ],
      "avg_width": 56.0,
      "avg_height": 128.0,
      "confidence": 0.7,
      "extraction_method": "fallback"
    },
    "F": {
      "variants": [
        "glyphs/upper_F_fallback.png"
      ],
      "avg_width": 36.0,
      "avg_height": 128.0,
      "confidence": 0.7,
      "extraction_method": "fallback"
    },
    "G": {
      "variants": [
        "glyphs/upper_G_fallback.png"
      ],
      "avg_width": 87.0,
      "avg_height": 128.0,
      "confidence": 0.7,
      "extraction_method": "fallback"
    },
    "H": {
      "variants": [
        "glyphs/upper_H_fallback.png"
      ],
      "avg_width": 79.0,
      "avg_height": 128.0,
      "confidence": 0.7,
      "extraction_method": "fallback"
    },
    "I": {
      "variants": [
        "glyphs/upper_I_fallback.png"
      ],
      "avg_width": 101.0,
      "avg_height": 128.0,
      "confidence": 0.7,
      "extraction_method": "fallback"
    },
    "J": {
      "variants": [
        "glyphs/upper_J_fallback.png"
      ],
      "avg_width": 33.0,
      "avg_height": 128.0,
      "confidence": 0.7,
      "extraction_method": "fallback"
    },
    "K": {
      "variants": [
        "glyphs/upper_K_fallback.png"
      ],
      "avg_width": 64.0,
      "avg_height": 128.0,
      "confidence": 0.7,
      "extraction_method": "fallback"
    },
    "L": {
      "variants": [
        "glyphs/upper_L_fallback.png"
      ],
      "avg_width": 72.0,
      "avg_height": 128.0,
      "confidence": 0.7,
      "extraction_method": "fallback"
    },
    "M": {
      "variants": [
        "glyphs/upper_M_fallback.png"
      ],
      "avg_width": 55.0,
      "avg_height": 128.0,
      "confidence": 0.7,
      "extraction_method": "fallback"
    },
    "N": {
      "variants": [
        "glyphs/upper_N_fallback.png"
      ],
      "avg_width": 111.0,
      "avg_height": 128.0,
      "confidence": 0.7,
      "extraction_method": "fallback"
    },
    "O": {
      "variants": [
        "glyphs/upper_O_fallback.png"
      ],
      "avg_width": 77.0,
      "avg_height": 128.0,
      "confidence": 0.7,
      "extraction_method": "fallback"
    },
    "P": {
      "variants": [
        "glyphs/upper_P_0.png"
      ],
      "avg_width": 75.0,
      "avg_height": 128.0,
      "confidence": 0.874,
      "extraction_method": "connected_component"
    },
    "Q": {
      "variants": [
        "glyphs/upper_Q_fallback.png"
      ],
      "avg_width": 50.0,
      "avg_height": 128.0,
      "confidence": 0.7,
      "extraction_method": "fallback"
    },
    "R": {
      "variants": [
        "glyphs/upper_R_fallback.png"
      ],
      "avg_width": 88.0,
      "avg_height": 128.0,
      "confidence": 0.7,
      "extraction_method": "fallback"
    },
    "S": {
      "variants": [
        "glyphs/upper_S_0.png"
      ],
      "avg_width": 89.0,
      "avg_height": 128.0,
      "confidence": 0.852,
      "extraction_method": "connected_component"
    },
    "T": {
      "variants": [
        "glyphs/upper_T_0.png"
      ],
      "avg_width": 71.0,
      "avg_height": 128.0,
      "confidence": 0.774,
      "extraction_method": "connected_component"
    },
    "U": {
      "variants": [
        "glyphs/upper_U_fallback.png"
      ],
      "avg_width": 93.0,
      "avg_height": 128.0,
      "confidence": 0.7,
      "extraction_method": "fallback"
    },
    "V": {
      "variants": [
        "glyphs/upper_V_fallback.png"
      ],
      "avg_width": 157.0,
      "avg_height": 128.0,
      "confidence": 0.7,
      "extraction_method": "fallback"
    },
    "W": {
      "variants": [
        "glyphs/upper_W_fallback.png"
      ],
      "avg_width": 93.0,
      "avg_height": 128.0,
      "confidence": 0.7,
      "extraction_method": "fallback"
    },
    "X": {
      "variants": [
        "glyphs/upper_X_fallback.png"
      ],
      "avg_width": 126.0,
      "avg_height": 128.0,
      "confidence": 0.7,
      "extraction_method": "fallback"
    },
    "Y": {
      "variants": [
        "glyphs/upper_Y_fallback.png"
      ],
      "avg_width": 167.0,